{"apiVersion":"delegation-resilience.org/v0alpha2","authenticatedIssuers":[{"id":"delegation-resilience-reference","independenceDomain":"reference-bundle-assembly","purposes":["verification_bundle"],"type":"organization"},{"id":"refund-dependency-observer","independenceDomain":"refund-configuration-observer","purposes":["dependency_snapshot"],"type":"workload"},{"id":"refund-game-day-runner","independenceDomain":"refund-exercise-runner","purposes":["exercise_attestation","exercise_evidence"],"type":"workload"}],"bundleDigest":"sha256:dce2e98bb168265dc3bc97a9a9c898f86a26b02b57cecf9374bf292b93b89988","checks":{"conformance":"VALID","freshness":"CURRENT_RELATIVE_TO_SNAPSHOT","integrity":"VERIFIED","issuerTrust":"TRUSTED","signature":"VALID"},"claimResults":[{"attestationDigest":"sha256:7c3906dceaa3b4c8fc4574233b3512a8e4291a52934a3e802ed3985cdbc3753c","attestedResult":"not_demonstrated","blockers":["attested result is not_demonstrated","required capabilities remain unsupported"],"claimRef":"refund-provider-outage","evidenceGaps":["No qualified human participated.","The 15-minute handover and 24-hour mission recovery were not exercised.","The provider, policy service, identity provider, and evidence sink were simulated.","Only response loss after commit was injected."],"freshness":"CURRENT_RELATIVE_TO_SNAPSHOT","supportedCapabilities":["external_reconciliation"],"unsupportedCapabilities":["containment","handover","human_takeover","mission_recovery","revalidation"],"verifiedSupport":"UNKNOWN"}],"decisionBoundary":{"deploymentDisposition":"NOT_EVALUATED"},"errors":[],"evaluatedAt":"2026-08-03T00:00:00Z","inputs":{"dependencySnapshotDigest":"sha256:199eb9397f1340916b167cbd447537d7846d66e06457a9438d5cb8e65aff3973","expectedVerifierCodeDigest":"sha256:5ad34c21d9998a5578ba0299fdd9bb576a88031df62264a9ebccc2850116e4f6","expectedVerifierEnvironmentDigest":"sha256:3d59c81663834a20809d62284938ade86036f6b070f5af4eb57d7ca743615813","minimumTrustPolicySequence":1,"trustPolicyDigest":"sha256:82e9abc9532a4ef15b48728f39be34977cfb035660cda62d5e4f2544aa0bc650","trustPolicySequenceNumber":1},"kind":"VerificationResult","limitations":["Signature validity binds bytes to an authorized key; it does not prove that an observation is truthful or complete.","The reference exercise is deterministic simulation and does not demonstrate human takeover, production equivalence, or general system safety.","Freshness is relative only to the caller-supplied signed dependency snapshot; the verifier does not observe the running deployment or prove the snapshot truthful.","The verifier environment digest covers the declared interpreter binary, platform ABI, and installed verifier-distribution files; it is not a hermetic runtime or process-integrity attestation and cannot exclude preloaded code, site customization, or operating-system compromise.","Deployment acceptability and legal or regulatory compliance remain accountable organizational decisions."],"packetVerificationOutcome":"PACKET_VERIFIED","verifier":{"codeDigest":"sha256:5ad34c21d9998a5578ba0299fdd9bb576a88031df62264a9ebccc2850116e4f6","environmentDigest":"sha256:3d59c81663834a20809d62284938ade86036f6b070f5af4eb57d7ca743615813","name":"delegation-resilience-portable-verifier","runtime":"CPython-3.12.8","version":"0.2.0-alpha.1"}}
